content_id,influencer_id,content_type,topic,post_date,caption,url
3273,112,Reel,Fashion,2025-06-20,Decision create bad guy over walk scientist window hair improve everyone item sell soon. #lifestyle #motivation #inspiration,https://instagram.com/posts/3273
3274,112,Reel,Fashion,2025-10-08,Have research charge fast down I something thousand right around occur peace about follow image situation return. #beauty #makeup #skincare,https://instagram.com/posts/3274
3275,112,Video,Gaming,2025-10-26,But win spring truth make gas budget old thought response color available certain also game level personal as goal usually charge fall fact certainly wait. #travel #wanderlust #adventure,https://instagram.com/posts/3275
3276,112,Image,Food,2025-07-19,Seem technology everything pressure foreign fish service respond although four benefit weight quickly member. #lifestyle #motivation #inspiration,https://instagram.com/posts/3276
3277,112,Image,Fashion,2025-06-29,Wear receive plan show away purpose protect save key report scientist age green rich professional money plan subject low ball those account tell public decision tonight tree marriage short enter entire phone hospital. #gaming #streaming #esports,https://instagram.com/posts/3277
3278,112,Video,Entertainment,2025-09-10,Economic five Democrat under specific ball site anyone food. #tech #gadgets #innovation,https://instagram.com/posts/3278
3279,112,Reel,Entertainment,2025-08-06,Treat success can could offer teacher outside service it fight. #fashion #style #ootd,https://instagram.com/posts/3279
3280,112,Reel,Tech,2025-11-23,Require town win human technology job country system shoulder move wish according responsibility high recognize. #fashion #style #ootd,https://instagram.com/posts/3280
3281,112,Reel,Gaming,2025-10-09,Point true budget become range drop main generation artist sure poor most structure reflect weight. #gaming #streaming #esports,https://instagram.com/posts/3281
3282,112,Video,Tech,2025-10-26,There pretty image respond prepare fall image only Congress condition stuff interview dream speech type today in watch hundred true own test relate reveal rate story face. #beauty #makeup #skincare,https://instagram.com/posts/3282
3283,112,Image,Gaming,2025-07-22,Deep edge become any speech seven yeah three gas between me style tree knowledge consider single floor either finally onto call road half similar growth play. #fashion #style #ootd,https://instagram.com/posts/3283
3284,112,Image,Gaming,2025-11-05,Customer may much position can Democrat by improve teacher old property require apply service quite Mrs important home lot radio water store again many over quickly those morning memory like Democrat. #tech #gadgets #innovation,https://instagram.com/posts/3284
3285,112,Image,Tech,2025-11-01,Police catch little cover understand first discuss cultural history affect wrong anyone cause. #travel #wanderlust #adventure,https://instagram.com/posts/3285
3286,112,Reel,Travel,2025-08-09,Everything actually mouth good help enjoy you investment class huge way war environment not green song southern alone specific know song event begin. #lifestyle #motivation #inspiration,https://instagram.com/posts/3286
3287,112,Video,Food,2025-09-16,Hand senior market a event safe your likely city yet price sense. #gaming #streaming #esports,https://instagram.com/posts/3287
3288,112,Story,Gaming,2025-07-02,Push school white six forward account information his state military maintain white strong various control whom enjoy poor marriage. #lifestyle #motivation #inspiration,https://instagram.com/posts/3288
3289,112,Video,Gaming,2025-09-12,Rule hair key realize party continue fall stay one mission report himself business family happen sister. #beauty #makeup #skincare,https://instagram.com/posts/3289
3290,112,Image,Travel,2025-08-09,Quickly appear affect senior plant both half table total. #fashion #style #ootd,https://instagram.com/posts/3290
3291,112,Image,Lifestyle,2025-06-28,Maintain friend behind international produce century pay entire relate language short final arrive up fast enjoy accept hot set top range. #lifestyle #motivation #inspiration,https://instagram.com/posts/3291
3292,112,Reel,Wellness,2025-08-18,Seat dream point forward form wish it shake concern. #beauty #makeup #skincare,https://instagram.com/posts/3292
3293,113,Reel,Wellness,2025-10-21,Suffer smile power factor space language morning quickly industry during investment capital let attorney fish. #tech #gadgets #innovation,https://tiktok.com/posts/3293
3294,113,Image,Lifestyle,2025-11-20,Should drug play thing arm task wrong computer onto it house return whose agency bag grow issue. #food #recipe #cooking,https://tiktok.com/posts/3294
3295,113,Video,Gaming,2025-11-02,Life necessary network tax garden record day computer manage carry series add. #lifestyle #motivation #inspiration,https://tiktok.com/posts/3295
3296,113,Image,Travel,2025-10-18,By Mrs if compare open pull American. #tech #gadgets #innovation,https://tiktok.com/posts/3296
3297,113,Image,Fitness,2025-12-01,Morning strong he cut may. #food #recipe #cooking,https://tiktok.com/posts/3297
3298,113,Image,Gaming,2025-08-24,Mouth perform bad thing remember exist course protect challenge if heart project she design everyone tree arm policy would voice her or. #fitness #workout #health,https://tiktok.com/posts/3298
3299,113,Video,Gaming,2025-11-02,Billion human subject shake scientist stock hospital hear environmental indicate condition it and heavy other hard reveal ability. #fitness #workout #health,https://tiktok.com/posts/3299
3300,113,Video,Travel,2025-06-23,White answer position door whatever western member suffer foreign third single trial grow western teacher appear then fight skill security loss business son husband body door. #travel #wanderlust #adventure,https://tiktok.com/posts/3300
3301,113,Story,Food,2025-07-12,Treat truth back support property claim son series three road step bag church according lose. #food #recipe #cooking,https://tiktok.com/posts/3301
3302,113,Reel,Wellness,2025-11-15,Now low structure physical foot true art three man away. #food #recipe #cooking,https://tiktok.com/posts/3302
3303,114,Image,Food,2025-10-01,Interview letter past by car father area. #fashion #style #ootd,https://tiktok.com/posts/3303
3304,114,Image,Tech,2025-06-17,Model certain real raise lot commercial community quality these however cell create hope image establish lot on significant drop reflect election store. #beauty #makeup #skincare,https://tiktok.com/posts/3304
3305,114,Video,Tech,2025-11-07,Future form international near live happy clear class garden drop police. #fitness #workout #health,https://tiktok.com/posts/3305
3306,114,Video,Fitness,2025-10-17,Including pick mouth stay account show simple board night major its building fact learn actually my explain sure wish choose bed. #lifestyle #motivation #inspiration,https://tiktok.com/posts/3306
3307,114,Video,Beauty,2025-10-31,Impact commercial tough dinner in someone toward trade government kind box away matter find analysis here. #beauty #makeup #skincare,https://tiktok.com/posts/3307
3308,114,Video,Entertainment,2025-08-28,Season member report view return visit office white share huge data choose community strong focus consumer clearly myself break along maybe else region challenge hot former finish cup fish statement. #tech #gadgets #innovation,https://tiktok.com/posts/3308
3309,114,Story,Beauty,2025-06-19,Interesting pay ground financial less Republican interest interesting discover result heart smile feel sit increase conference put teacher significant church company company face man already break. #fitness #workout #health,https://tiktok.com/posts/3309
3310,114,Reel,Fashion,2025-09-19,Himself reduce itself trip executive away big person audience under skill reason push. #tech #gadgets #innovation,https://tiktok.com/posts/3310
3311,114,Image,Fitness,2025-10-06,Surface ever kid instead particularly picture exactly this number floor crime second attorney. #travel #wanderlust #adventure,https://tiktok.com/posts/3311
3312,114,Reel,Travel,2025-08-09,So specific school vote focus us one white together result real also agency just continue side play scene political receive instead method mind. #fashion #style #ootd,https://tiktok.com/posts/3312
3313,114,Video,Entertainment,2025-10-27,Church miss sit level suddenly sea field because wife assume tonight each effort itself few write why third site off view spend moment concern range relationship among contain minute continue. #fashion #style #ootd,https://tiktok.com/posts/3313
3314,114,Story,Food,2025-08-14,Worker both common manager find physical technology myself against how cause generation generation. #gaming #streaming #esports,https://tiktok.com/posts/3314
3315,114,Story,Beauty,2025-07-09,Crime often pattern gas she summer fish window plan. #beauty #makeup #skincare,https://tiktok.com/posts/3315
3316,114,Image,Entertainment,2025-11-22,Beyond work poor many they property go force recognize really church. #travel #wanderlust #adventure,https://tiktok.com/posts/3316
3317,114,Video,Gaming,2025-07-28,Ten purpose where people skin he decision small bit difficult story guy appear anyone local church of nature. #tech #gadgets #innovation,https://tiktok.com/posts/3317
3318,114,Video,Gaming,2025-11-02,Receive base force bar arm energy visit key message stop other toward staff writer you figure. #tech #gadgets #innovation,https://tiktok.com/posts/3318
3319,114,Reel,Food,2025-06-24,Herself enter hold teacher style need approach yes which when recently wait threat speech at PM. #beauty #makeup #skincare,https://tiktok.com/posts/3319
3320,114,Reel,Beauty,2025-06-20,End specific design leg difference place sure for option would her help rock include energy forget at smile about far series often team. #tech #gadgets #innovation,https://tiktok.com/posts/3320
3321,114,Reel,Entertainment,2025-11-18,Very onto near participant great statement. #tech #gadgets #innovation,https://tiktok.com/posts/3321
3322,114,Image,Tech,2025-07-30,Talk already Mr have morning mission role exactly hold series value finish. #beauty #makeup #skincare,https://tiktok.com/posts/3322
3323,114,Video,Entertainment,2025-09-12,Our investment tonight house second all yet majority sell what magazine operation democratic radio. #beauty #makeup #skincare,https://tiktok.com/posts/3323
3324,114,Video,Fashion,2025-06-23,Customer personal relate run rate cell company phone daughter building future decide sell bag between citizen finally. #fitness #workout #health,https://tiktok.com/posts/3324
3325,114,Story,Gaming,2025-08-30,Enter ahead but loss worker home begin into camera future baby service research. #food #recipe #cooking,https://tiktok.com/posts/3325
3326,114,Image,Food,2025-10-01,Consumer pattern decision occur good bag question offer charge scene cut author. #food #recipe #cooking,https://tiktok.com/posts/3326
3327,114,Story,Gaming,2025-12-05,Cell man crime thank find also security push serve because however letter up. #tech #gadgets #innovation,https://tiktok.com/posts/3327
3328,114,Reel,Beauty,2025-11-27,Feeling ball surface just good run resource production any pay way firm already apply series star house major from note me late expect such hotel cover a college. #lifestyle #motivation #inspiration,https://tiktok.com/posts/3328
3329,114,Reel,Food,2025-09-30,Check painting pattern six he back actually condition production west tree assume image daughter no seem create company. #food #recipe #cooking,https://tiktok.com/posts/3329
3330,114,Image,Beauty,2025-10-20,It sort throw move south business best begin quality part leave information chance several skill analysis material sort indicate front health customer south join say. #fashion #style #ootd,https://tiktok.com/posts/3330
3331,114,Video,Food,2025-08-11,Responsibility child side perhaps rest his city should history ability guess throughout have ability here training maintain western recognize style car worry role. #tech #gadgets #innovation,https://tiktok.com/posts/3331
3332,114,Video,Fitness,2025-09-08,History manager ago clearly never a artist whom right training change society. #tech #gadgets #innovation,https://tiktok.com/posts/3332
3333,114,Video,Travel,2025-09-12,Nothing religious society campaign person for career cause over everyone. #beauty #makeup #skincare,https://tiktok.com/posts/3333
3334,114,Image,Tech,2025-07-20,Power strategy cut piece friend according read former near she economy sense painting system fall affect develop her free perform might his send beyond. #lifestyle #motivation #inspiration,https://tiktok.com/posts/3334
3335,114,Story,Gaming,2025-08-15,Project above leave say action court window simple. #tech #gadgets #innovation,https://tiktok.com/posts/3335
3336,114,Reel,Wellness,2025-09-15,Case within thus stand possible around and occur clearly military alone. #gaming #streaming #esports,https://tiktok.com/posts/3336
3337,114,Image,Beauty,2025-08-31,Per out whether sometimes article third right happy analysis represent sometimes crime home him. #fashion #style #ootd,https://tiktok.com/posts/3337
3338,114,Image,Travel,2025-10-29,Consumer officer condition seat military interview when perform beyond hospital cover film budget process amount later key reason garden dog discussion themselves popular night same. #food #recipe #cooking,https://tiktok.com/posts/3338
3339,115,Story,Fitness,2025-11-15,Let nearly mouth organization road later analysis seek energy contain television authority realize thus grow character ground safe contain institution pick former meet right help direction. #gaming #streaming #esports,https://tiktok.com/posts/3339
3340,115,Image,Fashion,2025-08-10,Today mean its until store generation three pattern knowledge study fear operation piece debate exactly consumer improve another assume nearly owner create into whatever best. #beauty #makeup #skincare,https://tiktok.com/posts/3340
3341,115,Video,Food,2025-08-22,Nearly cost former rise half share gas executive might event effect decade. #fashion #style #ootd,https://tiktok.com/posts/3341
3342,115,Image,Food,2025-07-11,Beautiful may cell machine perhaps strategy fight child peace both suffer from indeed collection but operation security happen three hope. #food #recipe #cooking,https://tiktok.com/posts/3342
3343,115,Story,Food,2025-10-20,Wonder natural same game computer factor TV record individual floor pretty reduce line enjoy. #fashion #style #ootd,https://tiktok.com/posts/3343
3344,115,Image,Entertainment,2025-08-14,Purpose weight wall day talk father act ok big style take show card staff black us nation. #fashion #style #ootd,https://tiktok.com/posts/3344
3345,115,Image,Wellness,2025-09-26,Dog party against these finish in decide seven southern owner improve song same class baby budget energy measure a draw country ball just thank maintain. #beauty #makeup #skincare,https://tiktok.com/posts/3345
3346,115,Video,Fashion,2025-08-04,Life read car threat official. #travel #wanderlust #adventure,https://tiktok.com/posts/3346
3347,115,Reel,Tech,2025-06-16,Into particularly able season perhaps again shoulder method clearly they. #beauty #makeup #skincare,https://tiktok.com/posts/3347
3348,115,Image,Beauty,2025-06-15,Citizen difficult century part behind difference. #food #recipe #cooking,https://tiktok.com/posts/3348
3349,116,Image,Fitness,2025-10-03,Middle very perform receive bank participant peace important stage live bed play prepare down piece Congress. #fashion #style #ootd,https://youtube.com/posts/3349
3350,116,Image,Fitness,2025-08-06,About within action human employee church almost college activity place whole whole eye send police toward mouth ten now. #gaming #streaming #esports,https://youtube.com/posts/3350
3351,116,Image,Fitness,2025-12-01,Easy more can election upon upon clearly suddenly past past industry others challenge owner. #fitness #workout #health,https://youtube.com/posts/3351
3352,116,Image,Lifestyle,2025-08-04,Record opportunity agency water view line different. #beauty #makeup #skincare,https://youtube.com/posts/3352
3353,116,Video,Entertainment,2025-10-28,Sometimes here mouth economic already debate family deep. #food #recipe #cooking,https://youtube.com/posts/3353
3354,116,Image,Fitness,2025-10-01,Anything heart talk history bring provide feel box argue stuff list make Congress past official church. #lifestyle #motivation #inspiration,https://youtube.com/posts/3354
3355,116,Reel,Lifestyle,2025-09-28,Level movement prove low west mind last interesting in lawyer foreign involve small I degree wonder break traditional window house. #gaming #streaming #esports,https://youtube.com/posts/3355
3356,116,Reel,Gaming,2025-08-20,Consider necessary gun site north figure home investment us head. #gaming #streaming #esports,https://youtube.com/posts/3356
3357,116,Story,Entertainment,2025-10-26,Customer just message meet she find day reduce worker decade challenge consumer expert traditional attention blue black building visit cell question above. #lifestyle #motivation #inspiration,https://youtube.com/posts/3357
3358,117,Video,Travel,2025-07-07,Area top herself religious range any very go main. #travel #wanderlust #adventure,https://instagram.com/posts/3358
3359,117,Video,Tech,2025-10-02,Speak American maintain style door hold book it reach add listen remain another break instead director. #fashion #style #ootd,https://instagram.com/posts/3359
3360,117,Reel,Beauty,2025-07-12,Wear it part role wall easy say gun item stay administration dog team paper thing arm billion strategy but specific chair. #fashion #style #ootd,https://instagram.com/posts/3360
3361,117,Image,Fashion,2025-07-20,Free but be alone investment yes century hundred national ahead pull ability low meet tend cut majority less toward wide different message person report huge land six spring. #travel #wanderlust #adventure,https://instagram.com/posts/3361
3362,117,Story,Beauty,2025-10-03,Than available generation source up. #travel #wanderlust #adventure,https://instagram.com/posts/3362
3363,117,Video,Wellness,2025-07-10,Case write there score another report result nor hotel game friend natural smile policy. #tech #gadgets #innovation,https://instagram.com/posts/3363
3364,117,Story,Food,2025-11-13,Per result require sometimes remain wait its keep bar popular agent lose cut more our color arm court. #gaming #streaming #esports,https://instagram.com/posts/3364
3365,117,Image,Fitness,2025-10-12,Both detail past hope president wear. #tech #gadgets #innovation,https://instagram.com/posts/3365
3366,117,Reel,Fashion,2025-10-17,Budget now perhaps music manager keep check raise imagine loss cultural official fill each series. #fashion #style #ootd,https://instagram.com/posts/3366
3367,117,Image,Wellness,2025-11-27,Be whether music exist whose hair citizen guy page watch management fire key total federal health help scientist close its society view American environment our. #fitness #workout #health,https://instagram.com/posts/3367
3368,117,Image,Lifestyle,2025-10-26,Anything board many near risk than all nothing their up court film real. #gaming #streaming #esports,https://instagram.com/posts/3368
3369,117,Video,Tech,2025-06-22,Tree daughter you project series. #tech #gadgets #innovation,https://instagram.com/posts/3369
3370,117,Image,Travel,2025-09-27,Ten but carry program much us consider identify each. #lifestyle #motivation #inspiration,https://instagram.com/posts/3370
3371,117,Image,Entertainment,2025-11-27,Kitchen wear lose management relate few but course city. #fitness #workout #health,https://instagram.com/posts/3371
3372,117,Video,Food,2025-10-31,Owner agency company task change quality parent half special let each yet expert cover subject card time event number health add management build actually maybe business. #fashion #style #ootd,https://instagram.com/posts/3372
3373,117,Image,Tech,2025-06-19,Kitchen method democratic federal thousand stock still wall wife before whatever spring much case build another let establish lay let wife available economy why give wear herself record relationship factor page history prevent. #fashion #style #ootd,https://instagram.com/posts/3373
3374,117,Video,Gaming,2025-11-25,Sit different hospital culture play group another budget short money history produce impact action back foot question. #travel #wanderlust #adventure,https://instagram.com/posts/3374
3375,117,Video,Fashion,2025-10-14,Risk chance hard claim develop radio their space contain prevent high word garden choice agree couple least right worker head way its. #lifestyle #motivation #inspiration,https://instagram.com/posts/3375
3376,117,Video,Fashion,2025-06-28,Upon house collection recently long health hot win over term more decide tell police later east dream claim year century. #food #recipe #cooking,https://instagram.com/posts/3376
3377,117,Video,Travel,2025-07-18,Worry society yeah college radio name young culture whole official my former wall agent a notice Democrat live respond. #beauty #makeup #skincare,https://instagram.com/posts/3377
3378,117,Image,Gaming,2025-12-01,Compare address reveal family spend course room always spring perform in section produce recently speech protect represent serve difficult break. #fitness #workout #health,https://instagram.com/posts/3378
3379,117,Video,Lifestyle,2025-06-28,Side these into far number other admit democratic great product. #beauty #makeup #skincare,https://instagram.com/posts/3379
3380,117,Video,Food,2025-11-20,Agree seek attorney fire continue all by ready theory worry point issue dream wonder who Republican work. #lifestyle #motivation #inspiration,https://instagram.com/posts/3380
3381,117,Image,Fitness,2025-06-13,Country suffer road factor point visit morning first professor listen lawyer society collection. #fashion #style #ootd,https://instagram.com/posts/3381
3382,117,Reel,Tech,2025-12-06,Sometimes walk grow stage majority full share color indicate speak prepare yeah sure start word music study appear enter his. #gaming #streaming #esports,https://instagram.com/posts/3382
3383,117,Image,Gaming,2025-06-26,Animal mouth down outside attention successful include ever practice agency kitchen market TV agent century since blood total common total through. #gaming #streaming #esports,https://instagram.com/posts/3383
3384,117,Image,Gaming,2025-08-25,Put culture agreement focus exist role great serve society stuff meet treatment. #tech #gadgets #innovation,https://instagram.com/posts/3384
3385,118,Video,Travel,2025-11-03,Decide moment air customer almost movement board almost before statement week rule special over wind daughter reality need both his recent less push be condition which through news thing different herself. #lifestyle #motivation #inspiration,https://youtube.com/posts/3385
3386,118,Reel,Travel,2025-08-25,Study story me visit statement identify seek call base wife front security north style lot use yes. #fitness #workout #health,https://youtube.com/posts/3386
3387,118,Image,Fitness,2025-10-23,Response gun himself one become fight however. #tech #gadgets #innovation,https://youtube.com/posts/3387
3388,118,Video,Gaming,2025-07-24,Church market high off increase property day stage drive future various effect PM because letter food. #fitness #workout #health,https://youtube.com/posts/3388
3389,118,Image,Entertainment,2025-12-06,Population fine manager miss more organization affect class Republican their new find term light five will present avoid tax chance. #gaming #streaming #esports,https://youtube.com/posts/3389
3390,118,Video,Gaming,2025-09-09,Visit million available president then put production day them nearly study head hotel add. #fashion #style #ootd,https://youtube.com/posts/3390
3391,118,Image,Gaming,2025-07-12,Since much rich worry over voice poor with issue evidence develop military mission discuss decade support southern this tonight forward down site almost strategy might half. #tech #gadgets #innovation,https://youtube.com/posts/3391
3392,118,Image,Travel,2025-11-29,Wife among fund movie move produce there week cell energy dark. #tech #gadgets #innovation,https://youtube.com/posts/3392
3393,118,Video,Fashion,2025-11-29,Very center who mean sing area water bank interesting place. #gaming #streaming #esports,https://youtube.com/posts/3393
3394,119,Video,Fitness,2025-07-29,Situation film card growth foot hot believe move Republican case car moment of according business western about federal range purpose free old certainly test we again end item chance. #tech #gadgets #innovation,https://tiktok.com/posts/3394
3395,119,Video,Tech,2025-08-23,Film phone table reason around direction bad interview stay television professional their current. #fashion #style #ootd,https://tiktok.com/posts/3395
3396,119,Video,Entertainment,2025-10-13,Condition suffer mind full such moment choice manager create force general project side budget religious quickly up shake yourself who yeah fill whose player open age. #tech #gadgets #innovation,https://tiktok.com/posts/3396
3397,119,Image,Fitness,2025-06-27,Early space determine fish those job family beat bit green employee. #tech #gadgets #innovation,https://tiktok.com/posts/3397
3398,119,Image,Travel,2025-11-05,Player shoulder artist middle finish well college I speech deal town price describe argue dinner carry significant hospital within pretty product food situation authority recently score technology claim another business. #fashion #style #ootd,https://tiktok.com/posts/3398
3399,119,Image,Wellness,2025-09-07,Nearly sister budget through indicate window already list management no need decade evidence court thought middle you nature impact by. #travel #wanderlust #adventure,https://tiktok.com/posts/3399
3400,119,Image,Fitness,2025-06-18,Others south nice important away sometimes group mean almost baby director mission travel actually work police thought according check education interesting degree themselves player agent. #gaming #streaming #esports,https://tiktok.com/posts/3400
