content_id,influencer_id,content_type,topic,post_date,caption,url
1,1,Reel,Entertainment,2025-12-06,Another fire them modern blue population against move scene. #beauty #makeup #skincare,https://youtube.com/posts/1
2,1,Video,Beauty,2025-11-20,Without product edge ahead process plant somebody yes process although provide scientist especially watch national. #lifestyle #motivation #inspiration,https://youtube.com/posts/2
3,1,Video,Fitness,2025-06-28,Agree training morning interest leg but shake stock. #food #recipe #cooking,https://youtube.com/posts/3
4,1,Image,Beauty,2025-06-11,Everyone recognize reduce which term my professor prevent drop throw total politics guy road. #travel #wanderlust #adventure,https://youtube.com/posts/4
5,1,Video,Wellness,2025-11-24,Skill prove turn theory science need simple course us perform near away effort chance. #fitness #workout #health,https://youtube.com/posts/5
6,1,Story,Gaming,2025-08-31,Stop guy least plan structure wonder try head Democrat democratic as today student sense international activity commercial price fire set top half anyone improve. #fashion #style #ootd,https://youtube.com/posts/6
7,1,Video,Lifestyle,2025-06-30,Create radio attack still else whether land. #beauty #makeup #skincare,https://youtube.com/posts/7
8,1,Image,Lifestyle,2025-11-13,Reality bar million plan treat speak military investment event cultural law movement nation wind beyond. #tech #gadgets #innovation,https://youtube.com/posts/8
9,1,Reel,Gaming,2025-11-06,Improve impact these must plan let police same attention radio begin. #gaming #streaming #esports,https://youtube.com/posts/9
10,1,Image,Beauty,2025-09-23,Close treat stay similar big her power yet kid especially wonder manager magazine total cost. #lifestyle #motivation #inspiration,https://youtube.com/posts/10
11,1,Reel,Wellness,2025-08-19,Add magazine energy arrive young whom daughter idea pay soldier he case cell. #travel #wanderlust #adventure,https://youtube.com/posts/11
12,1,Image,Entertainment,2025-06-17,Your while benefit deep notice itself. #gaming #streaming #esports,https://youtube.com/posts/12
13,1,Video,Lifestyle,2025-07-30,Protect bag detail though place leg national thing performance bring maintain father hospital. #food #recipe #cooking,https://youtube.com/posts/13
14,1,Image,Lifestyle,2025-11-15,Recent sign black style through teach voice rule process project city we water enough require become entire determine onto spring thing time watch. #gaming #streaming #esports,https://youtube.com/posts/14
15,1,Video,Lifestyle,2025-11-26,Piece learn animal especially on face cold. #tech #gadgets #innovation,https://youtube.com/posts/15
16,1,Image,Lifestyle,2025-08-09,Heart information feel into despite clear almost among include everybody. #fitness #workout #health,https://youtube.com/posts/16
17,1,Video,Wellness,2025-10-11,Realize door this tough its statement should loss ago fall. #fitness #workout #health,https://youtube.com/posts/17
18,1,Image,Fashion,2025-08-24,Part open color young court former who avoid eat whom source experience reason ahead yeah memory. #tech #gadgets #innovation,https://youtube.com/posts/18
19,1,Story,Travel,2025-12-02,Head dream growth thank receive treatment tend memory choose seven political billion Democrat must message. #lifestyle #motivation #inspiration,https://youtube.com/posts/19
20,1,Image,Travel,2025-08-19,Raise believe PM represent unit company police work really certainly quality land eat firm cup agree future. #travel #wanderlust #adventure,https://youtube.com/posts/20
21,1,Reel,Tech,2025-08-06,Anything trip drive theory black. #tech #gadgets #innovation,https://youtube.com/posts/21
22,1,Video,Tech,2025-08-02,Cup explain indicate effect food black include few house fill since total player among evening represent story yeah light. #fitness #workout #health,https://youtube.com/posts/22
23,1,Image,Food,2025-10-10,Performance particularly else cultural head goal clearly along green tax tend perform how technology in campaign idea most here such take. #travel #wanderlust #adventure,https://youtube.com/posts/23
24,1,Reel,Gaming,2025-08-07,Beyond low board pick push risk will eight thus sort its past from establish study rule significant wait itself news white natural. #beauty #makeup #skincare,https://youtube.com/posts/24
25,1,Video,Lifestyle,2025-10-29,Use song including least imagine short throughout all listen physical simply south forward drop just visit game soldier ask current. #fashion #style #ootd,https://youtube.com/posts/25
26,1,Video,Beauty,2025-10-08,Talk long letter stop well improve during. #gaming #streaming #esports,https://youtube.com/posts/26
27,1,Reel,Wellness,2025-08-02,Realize ability all relate picture draw executive college event will decade summer benefit. #fashion #style #ootd,https://youtube.com/posts/27
28,1,Reel,Fashion,2025-11-03,Low police herself issue relationship before television store result whose. #fitness #workout #health,https://youtube.com/posts/28
29,1,Video,Beauty,2025-08-18,Meet staff discussion mind traditional since chair program central. #food #recipe #cooking,https://youtube.com/posts/29
30,1,Video,Lifestyle,2025-11-23,Kid window data rise able return Congress form town finish store artist main word sure play can gun dark vote yard with last material certainly issue public. #travel #wanderlust #adventure,https://youtube.com/posts/30
31,1,Reel,Tech,2025-08-01,Minute fall page rock camera clear nation admit half meeting lead unit read street catch include happy structure size rock laugh seek full hair certainly. #gaming #streaming #esports,https://youtube.com/posts/31
32,1,Image,Wellness,2025-07-01,Structure news health return my customer player water send attorney total out mother opportunity turn exactly society piece. #lifestyle #motivation #inspiration,https://youtube.com/posts/32
33,1,Image,Beauty,2025-09-01,Very line focus nice writer approach manage body performance hair this everyone customer player remain offer south wear support voice sometimes wish difference dark note religious reason. #fashion #style #ootd,https://youtube.com/posts/33
34,1,Reel,Food,2025-08-05,Plant choose him whole arm level almost approach reality special join responsibility age get will section town help record party pick network recently college other various every. #gaming #streaming #esports,https://youtube.com/posts/34
35,1,Reel,Travel,2025-07-23,Onto man agreement any over coach prepare three prepare form physical hit tend. #tech #gadgets #innovation,https://youtube.com/posts/35
36,1,Image,Travel,2025-09-18,Life ago act field inside attention finally institution open a international woman small who leave throw discover make official for current street share with key human president modern professional door card travel best. #lifestyle #motivation #inspiration,https://youtube.com/posts/36
37,2,Video,Tech,2025-08-06,Else message cost job up something decision day fact morning who federal no growth mind significant forget. #beauty #makeup #skincare,https://youtube.com/posts/37
38,2,Image,Travel,2025-07-31,Provide prevent activity six data right clear nor end nearly answer order young. #travel #wanderlust #adventure,https://youtube.com/posts/38
39,2,Image,Wellness,2025-10-10,Improve wife the whole relationship environment between short. #fashion #style #ootd,https://youtube.com/posts/39
40,2,Video,Entertainment,2025-08-11,Whole drug month word something national source child phone owner send eat whole north half myself live concern employee visit beautiful lead head friend resource away wind I fund. #lifestyle #motivation #inspiration,https://youtube.com/posts/40
41,2,Image,Lifestyle,2025-09-28,Stop just community cost everything receive up accept back state certainly. #food #recipe #cooking,https://youtube.com/posts/41
42,2,Reel,Wellness,2025-07-19,My treat religious list by mean kid whose believe enter discuss realize not remember party she anything lawyer though others local draw order yeah so yet. #gaming #streaming #esports,https://youtube.com/posts/42
43,2,Image,Food,2025-07-07,About really herself education not eye soon garden tough prepare summer husband stay short decide somebody two eight upon time right turn. #tech #gadgets #innovation,https://youtube.com/posts/43
44,2,Image,Food,2025-09-02,Politics black take address practice rich soon yet plant boy rich rather science budget item. #beauty #makeup #skincare,https://youtube.com/posts/44
45,2,Image,Beauty,2025-09-29,Certain best month oil issue might yourself outside law meet Mr decision international race page understand help control ever right staff national at list commercial close month sister. #beauty #makeup #skincare,https://youtube.com/posts/45
46,2,Video,Fitness,2025-08-25,Financial of so pass law particular total approach list wind science marriage anything something shake. #beauty #makeup #skincare,https://youtube.com/posts/46
47,2,Reel,Fitness,2025-10-12,Word meet report often rule. #fashion #style #ootd,https://youtube.com/posts/47
48,2,Image,Travel,2025-10-20,Thank road its wall teach anyone parent part factor yes politics see. #food #recipe #cooking,https://youtube.com/posts/48
49,2,Image,Beauty,2025-07-12,Attention possible response husband small recently walk instead cut yeah. #gaming #streaming #esports,https://youtube.com/posts/49
50,2,Image,Fitness,2025-08-11,Which remain treatment plan defense American least about wish ground should hear according adult drug dream big financial difficult course dream our become old truth. #food #recipe #cooking,https://youtube.com/posts/50
51,2,Image,Fitness,2025-11-30,Million hour perform too in treatment car down we position poor camera focus decide receive. #fashion #style #ootd,https://youtube.com/posts/51
52,2,Image,Travel,2025-07-09,Model science two yourself street maintain reason all similar four respond natural break represent health practice majority per hot hit seem west anything training friend should. #fitness #workout #health,https://youtube.com/posts/52
53,2,Video,Beauty,2025-08-29,You space join until half card city across across choice ask. #fashion #style #ootd,https://youtube.com/posts/53
54,2,Reel,Fashion,2025-06-18,Structure everybody she ten usually ever hit eight course television scientist lead beautiful pay join nature its job bag federal security near box. #fashion #style #ootd,https://youtube.com/posts/54
55,2,Reel,Tech,2025-10-17,Wall thought among effect operation first voice. #tech #gadgets #innovation,https://youtube.com/posts/55
56,2,Image,Travel,2025-08-07,Western trade set how next raise forget individual past budget recently maybe. #fashion #style #ootd,https://youtube.com/posts/56
57,2,Video,Fashion,2025-06-14,Plant green parent beautiful best business series would. #beauty #makeup #skincare,https://youtube.com/posts/57
58,2,Image,Travel,2025-10-24,Kitchen realize throw product guy mean ability wear issue successful assume really. #fashion #style #ootd,https://youtube.com/posts/58
59,2,Story,Entertainment,2025-08-18,Market of full often develop happy notice just policy investment and design cold. #gaming #streaming #esports,https://youtube.com/posts/59
60,2,Reel,Gaming,2025-06-21,All everything serve never data official movie box whatever kind exactly less hotel when our send officer west surface sea per me several. #lifestyle #motivation #inspiration,https://youtube.com/posts/60
61,2,Video,Fitness,2025-10-04,Discussion way skill president whether benefit between agree nor student audience situation effort night task face coach chance most happen. #beauty #makeup #skincare,https://youtube.com/posts/61
62,2,Image,Fitness,2025-09-29,Table history special law such voice remember certain fast understand short executive. #fashion #style #ootd,https://youtube.com/posts/62
63,2,Image,Food,2025-07-08,Doctor bank require police security late enter game pass to task Republican billion assume show performance situation area take exactly picture thank. #gaming #streaming #esports,https://youtube.com/posts/63
64,2,Image,Lifestyle,2025-11-15,Side staff identify sell paper improve tough international strategy myself check indicate nature than skill police rather better I see machine matter thousand author. #tech #gadgets #innovation,https://youtube.com/posts/64
65,2,Video,Food,2025-09-26,Pm tree cup despite stop air hospital quickly friend. #fashion #style #ootd,https://youtube.com/posts/65
66,2,Video,Beauty,2025-10-08,You administration goal and available field clearly not state lawyer future base price voice. #beauty #makeup #skincare,https://youtube.com/posts/66
67,2,Video,Beauty,2025-07-24,Wall seven heart plan mind model conference use fire simple forget yourself say door card enjoy happy capital box ten give smile card. #lifestyle #motivation #inspiration,https://youtube.com/posts/67
68,2,Video,Beauty,2025-11-06,Surface sign degree fish song sit national music will material between remember audience area today possible prepare either sure. #lifestyle #motivation #inspiration,https://youtube.com/posts/68
69,2,Reel,Lifestyle,2025-11-29,Thousand structure media issue specific professional ball character kind happen item he me between police that alone. #lifestyle #motivation #inspiration,https://youtube.com/posts/69
70,2,Image,Travel,2025-10-18,You much car service successful score himself letter economy no rock gun allow management organization. #gaming #streaming #esports,https://youtube.com/posts/70
71,2,Video,Tech,2025-09-09,Check toward mother both performance among everything sometimes dog approach couple agent type green. #fashion #style #ootd,https://youtube.com/posts/71
72,2,Reel,Wellness,2025-07-30,Daughter resource must through market summer thought expect then civil week simple affect do approach talk east deep gun role technology. #fitness #workout #health,https://youtube.com/posts/72
73,2,Image,Fashion,2025-11-08,Method information identify avoid would should sing. #food #recipe #cooking,https://youtube.com/posts/73
74,2,Image,Beauty,2025-08-24,Again account break painting shoulder your college. #tech #gadgets #innovation,https://youtube.com/posts/74
75,2,Image,Entertainment,2025-09-03,Begin start experience lay they both bank reach must term machine boy nature those international theory heavy sport option discuss forward. #fashion #style #ootd,https://youtube.com/posts/75
76,2,Reel,Wellness,2025-10-20,Write another space here choose help among ready article vote condition admit development various. #tech #gadgets #innovation,https://youtube.com/posts/76
77,2,Image,Fitness,2025-08-15,Upon job political course center why thought child somebody scientist pay song difficult share. #gaming #streaming #esports,https://youtube.com/posts/77
78,2,Video,Lifestyle,2025-11-06,Interest wall hotel large boy reason mother seem. #food #recipe #cooking,https://youtube.com/posts/78
79,2,Video,Tech,2025-08-25,Community food animal there think religious other assume whatever it though only sound concern thing modern pull majority fall I look last far born. #gaming #streaming #esports,https://youtube.com/posts/79
80,2,Reel,Entertainment,2025-09-01,Respond by enough international animal herself entire situation style crime may. #travel #wanderlust #adventure,https://youtube.com/posts/80
81,3,Video,Food,2025-08-26,Federal cost product development nor sport image most factor issue mission morning soon. #beauty #makeup #skincare,https://instagram.com/posts/81
82,3,Video,Travel,2025-10-12,Term mention present step its behind no arrive artist shoulder skin audience. #fitness #workout #health,https://instagram.com/posts/82
83,3,Image,Tech,2025-07-03,Their very entire head television store area senior another join check pick building environment few. #gaming #streaming #esports,https://instagram.com/posts/83
84,3,Video,Fashion,2025-06-27,Idea wall TV create road leader guy agency half decision next others past media claim voice light difficult also decide significant through oil case allow. #fashion #style #ootd,https://instagram.com/posts/84
85,3,Story,Beauty,2025-11-12,Move actually information Mrs name yourself parent should it develop there less really dark behind add interview national moment occur laugh media else manager everything. #fashion #style #ootd,https://instagram.com/posts/85
86,3,Image,Fitness,2025-08-23,Return summer tough think image how whom perform cultural. #travel #wanderlust #adventure,https://instagram.com/posts/86
87,3,Image,Fitness,2025-07-25,Method last around third red authority that environmental chance admit decide set hear you white site life yet. #food #recipe #cooking,https://instagram.com/posts/87
88,3,Reel,Fitness,2025-08-30,Trouble change Mr rich interest possible fly just politics. #travel #wanderlust #adventure,https://instagram.com/posts/88
89,3,Video,Gaming,2025-09-02,Election science sort group size like would bar common skill best country. #beauty #makeup #skincare,https://instagram.com/posts/89
90,3,Story,Wellness,2025-11-11,Party chance role language my security process blue leader as stage well firm be night the food condition college fact bill member economy continue artist able take daughter base media forward painting technology. #gaming #streaming #esports,https://instagram.com/posts/90
91,3,Video,Food,2025-08-24,Question sit loss sometimes never senior suggest character person art news such present than get street character PM. #fashion #style #ootd,https://instagram.com/posts/91
92,3,Video,Lifestyle,2025-11-26,Trouble behind industry economy last prepare seat then along focus kind card any state. #fitness #workout #health,https://instagram.com/posts/92
93,3,Image,Fitness,2025-10-20,Station its national grow west positive bag bring music clearly beautiful open page wear four travel at remain after respond while teacher. #fitness #workout #health,https://instagram.com/posts/93
94,3,Image,Food,2025-08-27,System political hope upon call away policy southern administration summer. #fashion #style #ootd,https://instagram.com/posts/94
95,3,Reel,Food,2025-10-21,Personal happy or why actually simply describe less while manager represent should nor part drop decide play at science reality better movie. #beauty #makeup #skincare,https://instagram.com/posts/95
96,3,Image,Fashion,2025-07-07,There usually sort else rather practice movement growth name explain inside guy next fast. #travel #wanderlust #adventure,https://instagram.com/posts/96
97,3,Reel,Food,2025-06-12,Summer member buy cold know past involve among live result decision anything attack available theory already red people call. #beauty #makeup #skincare,https://instagram.com/posts/97
98,3,Image,Gaming,2025-08-25,Tell care turn spend result writer upon eight. #travel #wanderlust #adventure,https://instagram.com/posts/98
99,3,Video,Tech,2025-08-10,Push Democrat character daughter hospital. #fashion #style #ootd,https://instagram.com/posts/99
100,3,Reel,Gaming,2025-06-15,Media white growth bar region federal live research recent thus society. #food #recipe #cooking,https://instagram.com/posts/100
101,3,Image,Fashion,2025-10-13,Just reflect final final dog page wife nearly woman another teacher story ten traditional international reach participant although cold. #fashion #style #ootd,https://instagram.com/posts/101
102,3,Image,Beauty,2025-07-28,Trouble drive admit nor you social stand behavior do former series. #lifestyle #motivation #inspiration,https://instagram.com/posts/102
103,3,Video,Gaming,2025-10-07,Important ability high myself message purpose important development bar impact change whether close work majority training language computer thousand. #tech #gadgets #innovation,https://instagram.com/posts/103
104,3,Image,Beauty,2025-08-12,Family cell measure response cold just sign help tough on ability figure eye TV personal this product possible. #tech #gadgets #innovation,https://instagram.com/posts/104
105,3,Video,Gaming,2025-07-16,No sometimes final again TV message national gun tend life church hope face understand high risk. #lifestyle #motivation #inspiration,https://instagram.com/posts/105
106,3,Story,Entertainment,2025-09-10,Fund customer common both story think stand mind. #travel #wanderlust #adventure,https://instagram.com/posts/106
107,4,Reel,Gaming,2025-06-17,Land chair her me itself job away training color five ten voice store role section our require wife question major. #beauty #makeup #skincare,https://tiktok.com/posts/107
108,4,Image,Fitness,2025-09-28,Many yeah which forward site property play off run writer game week above plan physical produce record pick network effort provide memory write. #food #recipe #cooking,https://tiktok.com/posts/108
109,4,Story,Wellness,2025-08-02,Beautiful attorney high while effort want once old agree ahead officer task. #food #recipe #cooking,https://tiktok.com/posts/109
110,4,Image,Wellness,2025-06-14,Very yes education black ten main sure tell significant around enough. #gaming #streaming #esports,https://tiktok.com/posts/110
111,4,Video,Wellness,2025-10-21,And soon scene pick form here talk city evening box former authority drive couple know week always join huge own several military question almost better your. #lifestyle #motivation #inspiration,https://tiktok.com/posts/111
112,4,Video,Fashion,2025-07-27,Wait standard almost seven thank participant husband see tonight step use note improve. #lifestyle #motivation #inspiration,https://tiktok.com/posts/112
113,4,Reel,Fitness,2025-09-25,They meeting write child safe buy. #tech #gadgets #innovation,https://tiktok.com/posts/113
114,4,Image,Food,2025-07-19,Resource campaign government entire commercial send result author small purpose another character reduce type. #gaming #streaming #esports,https://tiktok.com/posts/114
115,4,Video,Food,2025-06-19,Painting available eight song paper natural specific though phone thank together several great lawyer need play lead rate Mrs west both pay realize organization. #tech #gadgets #innovation,https://tiktok.com/posts/115
116,4,Image,Lifestyle,2025-10-16,South value father remember somebody change community big cultural feeling role surface worker for bill. #lifestyle #motivation #inspiration,https://tiktok.com/posts/116
117,4,Video,Travel,2025-06-15,Compare story ahead school scientist candidate another space TV note place ten. #tech #gadgets #innovation,https://tiktok.com/posts/117
118,4,Video,Travel,2025-10-15,General recognize church look nice human short political necessary with high seat win behavior guess alone because vote its area behavior fast thank. #tech #gadgets #innovation,https://tiktok.com/posts/118
119,4,Image,Travel,2025-08-24,Already remain seem remember share break wrong poor size serious I six realize expert ball phone investment long answer design week young traditional. #beauty #makeup #skincare,https://tiktok.com/posts/119
120,4,Video,Lifestyle,2025-08-23,Else either medical people will leg large arm enter work will fill religious interview. #gaming #streaming #esports,https://tiktok.com/posts/120
121,4,Reel,Fitness,2025-07-31,Artist prove example keep television hit worker available concern anything. #tech #gadgets #innovation,https://tiktok.com/posts/121
122,4,Video,Tech,2025-07-07,Trade worker study bill again American almost father on. #beauty #makeup #skincare,https://tiktok.com/posts/122
123,4,Video,Gaming,2025-07-16,Yet much TV shake foreign view partner bag. #tech #gadgets #innovation,https://tiktok.com/posts/123
124,4,Reel,Travel,2025-07-05,According despite popular here save across positive day give operation. #gaming #streaming #esports,https://tiktok.com/posts/124
125,4,Image,Food,2025-09-27,Particular sound body experience treat large professional easy head short well nature expert budget issue network view spend three media evidence rich magazine drop need. #fashion #style #ootd,https://tiktok.com/posts/125
126,4,Image,Fashion,2025-06-15,Blood man near huge citizen in your nation question crime smile feel case. #tech #gadgets #innovation,https://tiktok.com/posts/126
127,4,Video,Wellness,2025-09-11,You young marriage community whose identify ahead why either know effect speech lead show perform house accept project up measure stand reflect entire performance medical life car but there executive. #travel #wanderlust #adventure,https://tiktok.com/posts/127
128,4,Video,Gaming,2025-11-30,Likely fill discussion whole page know your yet network himself interesting security. #food #recipe #cooking,https://tiktok.com/posts/128
129,4,Reel,Entertainment,2025-10-04,Study situation whether with art until region. #fitness #workout #health,https://tiktok.com/posts/129
130,4,Video,Wellness,2025-06-28,Each southern money recent rest attorney carry operation live themselves. #fitness #workout #health,https://tiktok.com/posts/130
131,4,Video,Tech,2025-07-18,Control take should girl toward worry technology test explain time show young good. #food #recipe #cooking,https://tiktok.com/posts/131
132,4,Story,Fashion,2025-06-19,Start leave section walk box garden partner minute no her. #food #recipe #cooking,https://tiktok.com/posts/132
133,5,Video,Tech,2025-07-25,Spend instead kid sometimes seat phone itself system sign beyond success ago improve address station three ground let one. #tech #gadgets #innovation,https://youtube.com/posts/133
134,5,Image,Travel,2025-11-16,Receive teach personal particular wait very truth offer thus. #food #recipe #cooking,https://youtube.com/posts/134
135,5,Video,Fashion,2025-06-30,That bed few none especially bag card like computer value activity return become computer seven yourself determine. #fashion #style #ootd,https://youtube.com/posts/135
136,5,Image,Lifestyle,2025-06-30,Son age say remember assume which study after house citizen add name. #beauty #makeup #skincare,https://youtube.com/posts/136
